Title,Link,Published Date
"Ist der selbsterklärte Volkskanzler in Wahrheit ein Kanzler der Reichen?","https://www.derstandard.at/story/3000000203901/ist-der-selbsterklaerte-volkskanzler-in-wahrheit-ein-kanzler-der-reichen?ref=rss","Sun, 21 Jan 2024 06:00:00 Z"
"Liveticker: Feller Dritter im ersten Durchgang von Kitzbühel","https://www.derstandard.at/jetzt/livebericht/3000000203972/ticker-slalom-in-kitzbuehel-so-ab-1030-uhr?ref=rss","Sat, 20 Jan 2024 18:06:22 Z"
"Netanjahu widerspricht Biden: Kein souveräner Palästinenserstaat","https://www.derstandard.at/jetzt/livebericht/3000000203979/netanjahu-widersprach-biden-kein-souveraener-palaestinenserstaat?ref=rss","Sun, 21 Jan 2024 06:56:15 Z"
"Gezielter Druck auf Investigativreporter in der Ukraine","https://www.derstandard.at/story/3000000203881/gezielter-druck-auf-investigativreporter-in-der-ukraine?ref=rss","Sun, 21 Jan 2024 06:00:00 Z"
"Proteste gegen Rechtsextremismus und AfD in ganz Deutschland","https://www.derstandard.at/story/3000000203961/tausende-teilnehmer-bei-demo-gegen-rechts-und-gegen-afd-in-frankfurt?ref=rss","Sat, 20 Jan 2024 13:42:58 Z"
"""Zitatjäger"" Gerald Krieghofer räumt mit den Halbwahrheiten auf","https://www.derstandard.at/story/3000000203834/zitatjaeger-gerald-krieghofer-raeumt-mit-den-halbwahrheiten-auf?ref=rss","Sun, 21 Jan 2024 10:00:00 Z"
"Tag 2 im Dschungel: Es menschelt zwischen Hate und krasser Liebe","https://www.derstandard.at/story/3000000203974/tag-2-im-dschungel-es-menschelt-zwischen-hate-und-krasser-liebe?ref=rss","Sun, 21 Jan 2024 10:15:13 Z"
"Wo Touristen 2024 zur Kasse gebeten werden","https://www.derstandard.at/story/3000000203860/wo-touristen-2024-zur-kasse-gebeten-werden?ref=rss","Sun, 21 Jan 2024 08:00:00 Z"
"13 Tote nach Beschuss der von Russland kontrollierten Stadt Donezk","https://www.derstandard.at/story/3000000203982/gasterminal-in-russland-in-brand-geraten?ref=rss","Sun, 21 Jan 2024 07:27:42 Z"
"Der Mythos vom ""guten Revolutionär"" Lenin","https://www.derstandard.at/story/3000000203902/der-mythos-vom-guten-revolutionaer-lenin?ref=rss","Sun, 21 Jan 2024 06:00:00 Z"
"Rechte Modellstadt? Wie FPÖ-Bürgermeister Rabl Wels umkrempelt","https://www.derstandard.at/story/3000000203914/rechte-modellstadt-wie-fpoe-mann-rabl-wels-umkrempelt?ref=rss","Sat, 20 Jan 2024 15:43:15 Z"
"Britische Behörde besorgt wegen Häufung von Masern","https://www.derstandard.at/story/3000000203983/britische-beh246rde-besorgt-wegen-h228ufung-von-masern?ref=rss","Sun, 21 Jan 2024 07:34:35 Z"
"Doppelmitgliedschaft mit Partei der Werteunion geht laut CDU nicht","https://www.derstandard.at/story/3000000204005/doppelmitgliedschaft-mit-partei-der-werteunion-geht-laut-cdu-nicht?ref=rss","Sun, 21 Jan 2024 11:23:12 Z"
"Italienische Behörden setzen Rettungsschiff Open Arms in Hafen fest","https://www.derstandard.at/story/3000000203993/italienische-beh246rden-setzen-rettungsschiff-open-arms-in-hafen-fest?ref=rss","Sun, 21 Jan 2024 09:24:55 Z"
"Demonstration gegen Grazer Akademikerball ohne Zwischenfälle","https://www.derstandard.at/story/3000000204002/grazer-akademikerball-demonstration-ohne-zwischenf228lle?ref=rss","Sun, 21 Jan 2024 10:59:28 Z"
"Cold Case um Mord an Joggerin in Frankreich wohl gelöst","https://www.derstandard.at/story/3000000203984/mord-an-joggerin-cold-case-in-frankreich-aus-2008-wohl-gel246st?ref=rss","Sun, 21 Jan 2024 07:41:40 Z"
"Braucht (m)ein Roman eine Triggerwarnung?","https://www.derstandard.at/story/3000000203870/braucht-mein-roman-eine-triggerwarnung?ref=rss","Sun, 21 Jan 2024 06:56:30 Z"
"""Toxisch"", ""schizo"", ""Trauma"", ""Trigger""? Wider die Pathologisierung des Alltags","https://www.derstandard.at/story/3000000203891/toxisch-schizo-trauma-trigger-wider-die-pathologisierung-des-alltags?ref=rss","Sat, 20 Jan 2024 09:03:25 Z"
"Einmischung ist wichtiger denn je","https://www.derstandard.at/story/3000000203918/einmischung-ist-wichtiger-denn-je?ref=rss","Sat, 20 Jan 2024 11:04:04 Z"
"E-Umstellung: Bald flüstern auch Lkws und Müllautos in Österreich","https://www.derstandard.at/story/3000000203504/e-umstellung-bald-fluestern-auch-lkws-und-muellautos-in-oesterreich?ref=rss","Sun, 21 Jan 2024 06:00:00 Z"
"Fondue-Wirt: ""Es ist nicht gut, ungern in die Arbeit zu gehen""","https://www.derstandard.at/story/3000000203636/fondue-wirt-es-ist-nicht-gut-ungern-in-die-arbeit-zu-gehen?ref=rss","Sun, 21 Jan 2024 06:00:00 Z"
"Die nächste Handball-Sensation: Österreich holt Remis gegen Deutschland","https://www.derstandard.at/story/3000000203976/die-naechste-handball-sensation-oesterreich-holt-remis-gegen-deutschland?ref=rss","Sat, 20 Jan 2024 21:25:21 Z"
"Österreichs Handballer sprechen nach Remis gegen Deutschland von ""verlorenem Punkt""","https://www.derstandard.at/story/3000000204003/oesterreichs-handballer-sprechen-nach-remis-gegen-deutschland-von-verlorenem-punkt?ref=rss","Sun, 21 Jan 2024 11:02:36 Z"
"Ondřej Cikán geht im neuen Buch ""Blühende Dämonen"" poetisch aufs Ganze","https://www.derstandard.at/story/3000000203829/wo-die-d228monen-bl252hen?ref=rss","Sun, 21 Jan 2024 10:00:00 Z"
"Djokovic läuft in Melbourne zur Topform auf","https://www.derstandard.at/story/3000000203992/djokovic-laeuft-in-melbourne-zur-topform-auf?ref=rss","Sun, 21 Jan 2024 09:00:53 Z"
"""Tatort"" aus Stuttgart mit Lannert und Bootz: Von wegen liebe Familie","https://www.derstandard.at/story/3000000203844/tatort-aus-stuttgart-mit-lannert-und-bootz-von-wegen-liebe-familie?ref=rss","Sun, 21 Jan 2024 10:00:00 Z"
"Shiffrin greift in Jasna nach dem 95. Sieg, nur Truppe in Top 20","https://www.derstandard.at/story/3000000203997/ski-alpin-shiffrin-in-jasna-vor-95-sieg-nur-truppe-in-top-20?ref=rss","Sun, 21 Jan 2024 10:24:30 Z"
"Caren Miosga folgt Anne Will nach: Ein alter Hase am neuen Talk-Tisch","https://www.derstandard.at/story/3000000203880/caren-miosga-folgt-anne-will-nach-ein-alter-hase-am-neuen-talk-tisch?ref=rss","Sun, 21 Jan 2024 08:00:00 Z"
"Trump verwechselt seine Rivalin Nikki Haley mit Nancy Pelosi","https://www.derstandard.at/story/3000000203978/trump-verwechselt-seine-rivalin-nikki-haley-mit-nancy-pelosi?ref=rss","Sat, 20 Jan 2024 21:44:57 Z"
"TV-Kult ""Baywatch"" unter der Zeitlupe","https://www.derstandard.at/story/3000000203920/tv-kult-baywatch-unter-der-zeitlupe?ref=rss","Sat, 20 Jan 2024 15:45:00 Z"
"Wie sich das Leben ohne Instagram anfühlt","https://www.derstandard.at/story/3000000203804/wie-sich-das-leben-ohne-instagram-anfuehlt?ref=rss","Sat, 20 Jan 2024 15:45:00 Z"
"Wie Hugo von Hofmannsthal das Lob des dezenten Menschen sang","https://www.derstandard.at/story/3000000203869/wie-hugo-von-hofmannsthal-das-lob-des-dezenten-menschen-sang?ref=rss","Sun, 21 Jan 2024 07:00:00 Z"
"Putin laut Nordkorea für baldigen Besuch bereit","https://www.derstandard.at/story/3000000203981/nordkorea-putin-f252r-baldigen-besuch-bereit?ref=rss","Sun, 21 Jan 2024 07:31:09 Z"
"Trump-Anhänger diffamieren Taylor Swift - ein alter Streit eskaliert","https://www.derstandard.at/story/3000000203893/trump-anhaenger-diffamieren-taylor-swift--ein-alter-streit-eskaliert?ref=rss","Sat, 20 Jan 2024 15:45:00 Z"
"Hans-Georg Maaßen gründet Deutschlands nächste Rechtspartei","https://www.derstandard.at/story/3000000203977/hans-georg-maassen-gruendet-deutschlands-naechste-rechtspartei?ref=rss","Sat, 20 Jan 2024 21:27:21 Z"
"Papst: Kinderkriegen ist eine Pflicht","https://www.derstandard.at/story/3000000203960/papst-kinderkriegen-ist-eine-pflicht?ref=rss","Sat, 20 Jan 2024 13:19:45 Z"
"NASA verliert Kontakt zu Mars-Hubschrauber","https://www.derstandard.at/story/3000000203973/nasa-verliert-kontakt-zu-mars-hubschrauber?ref=rss","Sat, 20 Jan 2024 18:23:02 Z"
"Ikea-Restaurant als Partnerbörse","https://www.derstandard.at/story/3000000203753/ikea-restaurant-als-partnerboerse?ref=rss","Sat, 20 Jan 2024 05:00:00 Z"
"Cannabisplantage hinter Kühlschranktür versteckt","https://www.derstandard.at/story/3000000203758/cannabisplantage-hinter-kuehlschranktuer-versteckt?ref=rss","Sat, 20 Jan 2024 08:00:00 Z"
"FPÖ rief zum Bauernprotest auf","https://www.derstandard.at/story/3000000203889/fpoe-rief-zum-bauernprotest-auf?ref=rss","Fri, 19 Jan 2024 14:57:19 Z"
"Teilnehmer von Protesten in Russland zu Haftstrafen verurteilt","https://www.derstandard.at/story/3000000203872/teilnehmer-von-protesten-in-russland-zu-haftstrafen-verurteilt?ref=rss","Fri, 19 Jan 2024 13:42:09 Z"
"Kein Pieps von Benko","https://www.derstandard.at/story/3000000203916/kein-pieps-von-benko?ref=rss","Fri, 19 Jan 2024 17:41:50 Z"
"Was bewirken Marco Pogo, KPÖ und vielleicht weitere Parteien?","https://www.derstandard.at/story/3000000203909/die-au223enseiterkandidaturen?ref=rss","Fri, 19 Jan 2024 17:52:22 Z"
"Die Möglichkeiten eines NS-Bauchredners sind begrenzt","https://www.derstandard.at/story/3000000203716/die-moeglichkeiten-eines-ns-bauchredners-sind-begrenzt?ref=rss","Fri, 19 Jan 2024 08:47:52 Z"
"Mehr Tempo-30-Zonen in Ortschaften werden nur ein Anfang sein","https://www.derstandard.at/story/3000000203655/mehr-tempo-30-zonen-in-ortschaften-werden-nur-ein-anfang-sein?ref=rss","Fri, 19 Jan 2024 07:00:00 Z"
"Netanjahus Nein zur Zweistaatenlösung ist sein böses Vermächtnis","https://www.derstandard.at/story/3000000203919/netanjahus-verm228chtnis?ref=rss","Fri, 19 Jan 2024 17:13:04 Z"
"Freiheit für Bargeld bedeutet Freiheit für die Mafia","https://www.derstandard.at/story/3000000203921/freiheit-f252r-die-mafia?ref=rss","Fri, 19 Jan 2024 17:47:51 Z"
"Die Konkurrenz muss auf einen blauen Skandal hoffen","https://www.derstandard.at/story/3000000203713/die-konkurrenz-muss-auf-einen-blauen-skandal-hoffen?ref=rss","Fri, 19 Jan 2024 09:01:02 Z"
"Das Jahr der Wiedergänger","https://www.derstandard.at/story/2000131912423/rudi-klein-der-lochgott?ref=rss","Tue, 14 Dec 2021 17:00:05 Z"
"Bauernprotest","https://www.derstandard.at/story/3000000201628/prognose-superwahljahr-2024?ref=rss","Tue, 02 Jan 2024 16:55:24 Z"
"Die Gesellschaft muss der rechtsextremen Lawine etwas entgegensetzen","https://www.derstandard.at/story/3000000203152/die-gesellschaft-muss-der-rechtsextremen-lawine-etwas-entgegensetzen?ref=rss","Wed, 17 Jan 2024 09:00:00 Z"
"Besser einschlafen durch Milch mit Honig?","https://www.derstandard.at/story/3000000202697/besser-einschlafen-durch-milch-mit-honig?ref=rss","Tue, 16 Jan 2024 07:00:00 Z"
"Quiz: Zehn Fragen an Ihr Allgemeinwissen!","https://www.derstandard.at/story/3000000203132/quiz-zehn-fragen-an-ihr-allgemeinwissen?ref=rss","Wed, 17 Jan 2024 06:00:00 Z"
"Wenn nach einer Scheidung über Partner und Kinder gepostet wird","https://www.derstandard.at/story/3000000202602/wenn-nach-einer-scheidung-ueber-partner-und-kinder-gepostet-wird?ref=rss","Tue, 16 Jan 2024 13:00:00 Z"
"Wer wird RTL-Dschungelkönigin oder -Dschungelkönig 2024?","https://www.derstandard.at/jetzt/livebericht/3000000203777/wer-wird-rtl-dschungelkoenigin-oder-dschungelkoenig-2024?ref=rss","Fri, 19 Jan 2024 10:31:57 Z"
"Kohlmeisen sind die Nummer eins","https://www.derstandard.at/story/3000000203262/kohlmeisen-sind-die-nummer-eins?ref=rss","Wed, 17 Jan 2024 07:00:00 Z"
"Österreichisches GmbH-Gesetz: Was bei Notfällen beachtet werden muss","https://www.derstandard.at/story/3000000203391/oesterreichisches-gmbh-gesetz-was-bei-notfaellen-beachtet-werden-muss?ref=rss","Thu, 18 Jan 2024 08:55:26 Z"
"AI Act: Regulierung mit wenig Treffsicherheit","https://www.derstandard.at/story/3000000203623/ai-act-regulierung-mit-wenig-treffsicherheit?ref=rss","Fri, 19 Jan 2024 10:00:00 Z"
"Wie der Krieg das Leben dominiert","https://www.derstandard.at/story/3000000203159/wie-der-krieg-das-leben-dominiert?ref=rss","Thu, 18 Jan 2024 14:17:57 Z"
"Psychotherapeutin: ""Eine Essstörung ist oft ein Schutzmechanismus für Betroffene""","https://www.derstandard.at/story/3000000203729/psychotherapeutin-eine-essstoerung-ist-oft-ein-schutzmechanismus-fuer-betroffene?ref=rss","Sat, 20 Jan 2024 11:05:09 Z"
"Was wir von Giraffen im Kampf gegen Herzerkrankungen lernen können","https://www.derstandard.at/story/3000000203816/was-wir-von-giraffen-im-kampf-gegen-herzerkrankungen-lernen-koennen?ref=rss","Sat, 20 Jan 2024 15:45:00 Z"
"Grüner Waitz zu EU-Wahl: ""Freue mich, wenn Lena Schilling mir die Show stiehlt""","https://www.derstandard.at/story/3000000203843/gruener-waitz-zu-eu-wahl-freue-mich-wenn-lena-schilling-mir-die-show-stiehlt?ref=rss","Sat, 20 Jan 2024 12:15:24 Z"
"Baltische Staaten bauen Verteidigungsanlagen zu Russland und Belarus","https://www.derstandard.at/jetzt/livebericht/3000000203736/baltische-staaten-bauen-verteidigungsanlagen-zu-russland-und-belarus?ref=rss","Fri, 19 Jan 2024 04:54:54 Z"
"In den Trümmern von Gaza: Angst zu sterben, bevor das Leben begonnen hat","https://www.derstandard.at/story/3000000203320/in-den-truemmern-von-gaza-angst-zu-sterben-bevor-das-leben-begonnen-hat?ref=rss","Sat, 20 Jan 2024 11:02:26 Z"
"Selenskyj lädt Trump nach Kiew ein","https://www.derstandard.at/story/3000000203957/ukraine-selenskyj-l228dt-trump-nach-kiew-ein?ref=rss","Sat, 20 Jan 2024 12:15:42 Z"
"Vier Mitglieder iranischer Revolutionsgarden bei Angriff in Syrien getötet","https://www.derstandard.at/jetzt/livebericht/3000000203930/neue-us-angriffe-auf-huthi-miliz-im-jemen?ref=rss","Sat, 20 Jan 2024 06:24:05 Z"
"Selenskyj beklagte ""Wahnsinn"" russischer Führung","https://www.derstandard.at/story/3000000203938/selenskyj-beklagte-wahnsinn-russischer-f252hrung?ref=rss","Sat, 20 Jan 2024 06:37:53 Z"
"Der Krieg in der Ukraine und die demografische Krise","https://www.derstandard.at/story/3000000203838/der-krieg-in-der-ukraine-und-die-demografische-krise?ref=rss","Sat, 20 Jan 2024 06:00:00 Z"
"Zehntausende SMS-Warnungen an Frauen im Iran nach Kopftuchverstößen","https://www.derstandard.at/story/3000000203996/zehntausende-sms-warnungen-an-frauen-im-iran-nach-kopftuchverst246223en?ref=rss","Sun, 21 Jan 2024 10:02:46 Z"
"Russland will Kriegskritiker bei ""Falschinfos"" über Armee enteignen","https://www.derstandard.at/story/3000000203966/russland-plant-konfiszierungsgesetz-bei-falschinfos-252ber-armee?ref=rss","Sat, 20 Jan 2024 14:48:48 Z"
"Irans Revolutionswächter befördern Satelliten in Erdumlaufbahn","https://www.derstandard.at/story/3000000203943/irans-revolutionsw228chter-bef246rdern-satelliten-in-erdumlaufbahn?ref=rss","Sat, 20 Jan 2024 09:14:19 Z"
"Deutsche Bauern übergeben Forderungen an Özdemir","https://www.derstandard.at/story/3000000203958/gr252ne-woche-deutsche-bauern-252bergeben-forderungen-an-214zdemir?ref=rss","Sat, 20 Jan 2024 12:35:22 Z"
"Lena Schilling soll fix für Grüne bei Europawahl antreten","https://www.derstandard.at/story/3000000203952/lena-schilling-soll-fix-fuer-gruene-bei-europawahl-antreten?ref=rss","Sat, 20 Jan 2024 11:12:54 Z"
"FPÖ-Jungpolitiker schwadroniert über Machtfantasien in Telefonmitschnitt","https://www.derstandard.at/story/3000000203944/fpoe-jungpolitiker-schwadroniert-ueber-machtfantasien-in-telefonmitschnitt?ref=rss","Sat, 20 Jan 2024 10:02:58 Z"
"Wiener Verein mit Ehrenurkunde von palästinensischer Terrorgruppe","https://www.derstandard.at/story/3000000203700/wiener-verein-mit-ehrenurkunde-von-palaestinensischer-terrorgruppe-pflp?ref=rss","Sat, 20 Jan 2024 13:00:00 Z"
"Einstweilige Verfügung gegen Darmkrebsvorsorge-Projekt der Stadt Wien","https://www.derstandard.at/story/3000000203946/einstweilige-verfuegung-gegen-darmvorsorge-projekt-der-stadt-wien?ref=rss","Sat, 20 Jan 2024 10:07:18 Z"
"Drei Euro pro Stimme: Wie sich der Antritt für Kleinparteien lohnen kann","https://www.derstandard.at/story/3000000203794/drei-euro-pro-stimme-wie-sich-der-antritt-fuer-kleinparteien-lohnen-kann?ref=rss","Sat, 20 Jan 2024 11:00:00 Z"
"Letzte Zeugin Lucia Heilman an die Jugend: ""Es liegt an euch!""","https://www.derstandard.at/story/3000000202982/letzte-zeugin-lucia-heilman-an-die-jugend-es-liegt-an-euch?ref=rss","Mon, 15 Jan 2024 07:00:00 Z"
"Steirischer SPÖ-Chef Lang mit 91,6 Prozent wiedergewählt","https://www.derstandard.at/story/3000000203947/steirischer-spoe-chef-lang-mit-916-prozent-wiedergewaehlt?ref=rss","Sat, 20 Jan 2024 10:14:44 Z"
"Weniger Autos, mehr Grün: Ländliche Kleinstädte kämpfen gegen den Verfall","https://www.derstandard.at/story/3000000200285/weniger-autos-mehr-gruen-laendliche-kleinstaedte-kaempfen-gegen-den-verfall?ref=rss","Sat, 20 Jan 2024 06:00:00 Z"
"Britische Ärzte entfernen sechsbeinigem Hund zwei Beine","https://www.derstandard.at/story/3000000203970/britische-aerzte-entfernen-sechsbeinigem-hund-zwei-beine?ref=rss","Sat, 20 Jan 2024 17:44:18 Z"
"Es wird warm und windig","https://www.derstandard.at/story/3000000203999/wetter-er-wird-warm-und-windig?ref=rss","Sun, 21 Jan 2024 10:52:04 Z"
"Identität des Toten nach Leichenfund im Marchfeldkanal geklärt","https://www.derstandard.at/story/3000000203948/leichenfund-im-marchfeldkanal-identit228t-des-toten-gekl228rt?ref=rss","Sat, 20 Jan 2024 10:09:13 Z"
"Russisches Privatflugzeug in Afghanistan abgestürzt","https://www.derstandard.at/story/3000000203988/russisches-privatflugzeug-in-afghanistan-abgest252rzt?ref=rss","Sun, 21 Jan 2024 09:23:44 Z"
"Nach tödlicher Messerattacke im Innviertel ist Sohn geständig","https://www.derstandard.at/story/3000000203963/nach-t246dlicher-messerattacke-im-innviertel-ist-sohn-gest228ndig?ref=rss","Sat, 20 Jan 2024 14:10:45 Z"
"Eisläufer am Neusiedler See weiterhin vermisst","https://www.derstandard.at/story/3000000203956/eisl228ufer-am-neusiedler-see-weiterhin-vermisst?ref=rss","Sat, 20 Jan 2024 11:54:34 Z"
"Schloss Schönbrunn und Kanzleramt mit Pfandrecht belastet","https://www.derstandard.at/story/3000000203905/schloss-schoenbrunn-und-kanzleramt-mit-pfandrecht-belastet?ref=rss","Sat, 20 Jan 2024 06:00:00 Z"
"Kein Aufstand: ""Is des ois an Bauern? Na, dann schau ma schlecht aus""","https://www.derstandard.at/story/3000000203912/kein-aufstand-is-des-ois-an-bauern-na-dann-schau-ma-schlecht-aus?ref=rss","Fri, 19 Jan 2024 17:17:52 Z"
"ÖBB bestellt 70 neue Elektrotriebzüge von Siemens Mobility","https://www.derstandard.at/story/3000000203796/oebb-bestellt-70-neue-elektrotriebzuege-von-siemens-mobility?ref=rss","Fri, 19 Jan 2024 10:03:09 Z"
"Ex-Kanzler Kurz und Ex-Kabinettschef Bonelli sind seit kurzem Geschäftspartner","https://www.derstandard.at/story/3000000203846/ex-kanzler-kurz-und-ex-kabinettschef-bonelli-sind-seit-kurzem-geschaeftspartner?ref=rss","Fri, 19 Jan 2024 12:23:31 Z"
"Gewinnabschöpfung bei Energiekonzernen soll verlängert werden","https://www.derstandard.at/story/3000000203962/gewinnabsch246pfung-bei-energiekonzernen-soll-verl228ngert-werden?ref=rss","Sat, 20 Jan 2024 13:54:44 Z"
"Kriminologe: ""Wer gegen Bargeldgrenzen kämpft, setzt sich für Terroristen und Geldwäscher ein""","https://www.derstandard.at/story/3000000203789/wer-gegen-bargeldgrenzen-kaempft-setzt-sich-fuer-terroristen-und-geldwaescher-ein?ref=rss","Fri, 19 Jan 2024 10:48:44 Z"
"Signa-Rettung: Die schwierigste Mission von ""Company-Doctor"" Grossnigg","https://www.derstandard.at/story/3000000203915/signa-sanierung-die-schwierigste-mission-von-company-doctor-grossnigg?ref=rss","Fri, 19 Jan 2024 17:10:29 Z"
"""The Last of Us 2 Remastered"": Warum Gewalt in Spielen ein Thema sein darf","https://www.derstandard.at/story/3000000203783/the-last-of-us-2-remastered-warum-gewalt-in-spielen-ein-thema-sein-darf?ref=rss","Sat, 20 Jan 2024 16:00:00 Z"
"Warum KI-Influencer im Superwahljahr zum politischen Instrument werden könnten","https://www.derstandard.at/story/3000000203474/warum-ki-influencer-zum-politischen-instrument-werden-koennten?ref=rss","Sat, 20 Jan 2024 14:02:39 Z"
"""Nicht rechtmäßig"": AK geht gegen Servicepauschale von Mobilfunkern vor","https://www.derstandard.at/story/3000000203842/nicht-rechtmaessig-ak-geht-gegen-servicepauschale-von-mobilfunkern-vor?ref=rss","Fri, 19 Jan 2024 14:44:24 Z"
"Die Flugauto-Zukunft nimmt Form an, auch in Europa","https://www.derstandard.at/story/3000000203514/die-flugauto-zukunft-nimmt-form-an-auch-in-europa?ref=rss","Sat, 20 Jan 2024 06:00:00 Z"
"Hinweise auf ein Remake des besten ""Assassin's Creed""-Teils verdichten sich","https://www.derstandard.at/story/3000000203895/hinweise-auf-ein-remake-des-besten-assassins-creed-teils-verdichten-sich?ref=rss","Sat, 20 Jan 2024 18:00:00 Z"
"Bitcoin-Kurs fällt nach Zulassung des langersehnten ETFs","https://www.derstandard.at/story/3000000203839/bitcoin-kurs-faellt-nach-zulassung-des-langersehnten-etfs?ref=rss","Fri, 19 Jan 2024 11:50:05 Z"
"OpenAI sperrt erstmals Bot-Entwickler in politischer Kampagne","https://www.derstandard.at/story/3000000203985/openai-sperrt-erstmals-bot-entwickler-in-politischer-kampagne?ref=rss","Sun, 21 Jan 2024 08:33:29 Z"
"Amazon überarbeitet Alexa und will dafür Abogebühren kassieren","https://www.derstandard.at/story/3000000203771/amazon-ueberarbeitet-alexa-und-will-dafuer-abogebuehren-kassieren?ref=rss","Fri, 19 Jan 2024 11:06:12 Z"
"Tesla soll auch 2030 noch immer der beliebteste Hersteller von E-Autos sein","https://www.derstandard.at/story/3000000203826/tesla-vw-prognose?ref=rss","Sat, 20 Jan 2024 09:00:00 Z"
"Samsung sieht Zukunft des Smartphones bei KI und arbeitet an persönlichem Assistenten","https://www.derstandard.at/story/3000000203743/samsung-sieht-zukunft-des-smartphones-bei-ki-und-arbeitet-an-persoenlichem-assistenten?ref=rss","Sat, 20 Jan 2024 11:08:30 Z"
"Leader Leverkusen setzt Siegesserie auch in Leipzig fort","https://www.derstandard.at/story/3000000203971/fu223ballklarer-verhinderte-mit-sp228tem-tor-frankfurt-sieg-in-darmstadt?ref=rss","Sat, 20 Jan 2024 17:51:34 Z"
"Sarrazin holt mit phänomenalem Lauf Abfahrtsdouble in Kitzbühel","https://www.derstandard.at/story/3000000203955/sarrazin-holt-mit-phaenomenalem-lauf-abfahrtsdouble-in-kitzbuehel?ref=rss","Sat, 20 Jan 2024 12:51:12 Z"
"Neumayer überrascht in Kitz als Zwölfter und beendete Karriere","https://www.derstandard.at/story/3000000203969/ski-neumayer-252berraschte-in-kitz-als-zw246lfter-und-beendete-karriere?ref=rss","Sat, 20 Jan 2024 17:44:22 Z"
"49ers und Ravens im NFL-Play-off weiter","https://www.derstandard.at/story/3000000203994/49ers-und-ravens-im-nfl-play-off-weiter?ref=rss","Sun, 21 Jan 2024 09:32:04 Z"
"Tennis-Forum+: Winter 2023/24","https://www.derstandard.at/jetzt/livebericht/3000000181787/tennis-forum-sommer-2023?ref=rss","Fri, 04 Aug 2023 14:24:52 Z"
"ÖSV-Adler gewinnen Teambewerb in Zakopane überlegen","https://www.derstandard.at/story/3000000203968/oesv-adler-gewinnen-teambewerb-in-zakopane-ueberlegen?ref=rss","Sat, 20 Jan 2024 17:07:05 Z"
"Eishockey-Forum+ 2023/24","https://www.derstandard.at/jetzt/livebericht/3000000184599/eishockey-forum-202324?ref=rss","Mon, 28 Aug 2023 12:21:08 Z"
"Schloss Cobenzl sucht schon wieder Nachmieter","https://www.derstandard.at/story/3000000203500/schloss-cobenzl-sucht-schon-wieder-nachmieter?ref=rss","Sat, 20 Jan 2024 11:00:00 Z"
"Die schönsten Urlaubsfotos unserer Userinnen und User der Woche","https://www.derstandard.at/story/3000000203135/die-schoensten-urlaubsfotos-unserer-userinnen-und-user-der-woche?ref=rss","Sat, 20 Jan 2024 08:00:00 Z"
"Wieso wird weibliche Nacktheit anders bewertet als die von Männern?","https://www.derstandard.at/story/3000000203863/wieso-wird-weibliche-nacktheit-anders-bewertet-als-die-von-maennern?ref=rss","Fri, 19 Jan 2024 18:49:17 Z"
"Mit Kindern ist ein aufgeräumtes Zuhause eine Utopie","https://www.derstandard.at/story/3000000203705/mit-kindern-ist-ein-aufgeraeumtes-zuhause-eine-utopie?ref=rss","Fri, 19 Jan 2024 14:45:39 Z"
"Hummus man lieben, die neue Tel-Aviv-Style-Bude in Alsergrund","https://www.derstandard.at/story/3000000203316/hummus-man-lieben-die-neue-tel-aviv-style-bude-in-alsergrund?ref=rss","Fri, 19 Jan 2024 11:00:00 Z"
"Was an US-Flughäfen alles aus dem Verkehr gezogen wird","https://www.derstandard.at/story/3000000203760/was-an-amerikanischen-flughaefen-alles-aus-dem-verkehr-gezogen-wird?ref=rss","Fri, 19 Jan 2024 12:08:24 Z"
"Emilia-Romagna will die Bahnverbindung zu Österreich ausbauen","https://www.derstandard.at/story/3000000203813/emilia-romagna-will-die-bahnverbindung-zu-214sterreich-ausbauen?ref=rss","Fri, 19 Jan 2024 10:50:17 Z"
"Gypsy Rose Blanchard: Vom Kriminalfall zum Internethype","https://www.derstandard.at/story/3000000203499/gypsy-rose-blanchard-vom-kriminalfall-zum-internethype?ref=rss","Fri, 19 Jan 2024 11:00:00 Z"
"Kim Kardashian bringt ihre Make-up-Linie zurück","https://www.derstandard.at/story/3000000203823/kim-kardashian-bringt-ihre-make-up-linie-zurueck?ref=rss","Fri, 19 Jan 2024 14:06:02 Z"
"Elias Hirschl nimmt in Roman ""Content"" die Generation ChatGPT ins Visier","https://www.derstandard.at/story/3000000203827/11-gro223artige-tipps-dein-leben-in-den-griff-zu-kriegen?ref=rss","Sat, 20 Jan 2024 15:03:27 Z"
"Ein Jodler in die Welt hinaus: Bad Ischl läutet Kulturhauptstadtjahr ein","https://www.derstandard.at/story/3000000203832/ein-jodler-in-die-welt-hinaus-bad-ischl-laeutet-kulturhauptstadtjahr-ein?ref=rss","Sat, 20 Jan 2024 06:00:00 Z"
"Neues Christine-Lavant-Lesebuch erzählt von der Kraft des Brennens","https://www.derstandard.at/story/3000000203828/neues-christine-lavant-lesebuch-erzaehlt-von-der-kraft-des-brennens?ref=rss","Sat, 20 Jan 2024 11:00:00 Z"
"Warum ein Oligarch das Auktionshaus Sotheby’s verklagt","https://www.derstandard.at/story/3000000203831/warum-ein-oligarch-das-auktionshaus-sothebys-verklagt?ref=rss","Sat, 20 Jan 2024 09:08:17 Z"
"Als die Theatervampire begannen, Michel Foucault zu lesen","https://www.derstandard.at/story/3000000203950/als-die-theatervampire-begannen-michel-foucault-zu-lesen?ref=rss","Sat, 20 Jan 2024 10:28:24 Z"
"Roman ""Der Flakon"" erzählt von weiblichem Widerstand gegen männliche Kriegsgewalt","https://www.derstandard.at/story/3000000203841/weiblicher-widerstand-gegen-m228nnliche-kriegsgewalt?ref=rss","Sat, 20 Jan 2024 13:00:00 Z"
